videoId,title,channel,publishedAt,views,likes,comments
xp8LSd3bwc8,"FULL Giả Mạo Quan Công Để Lừa Tiền, Chàng Trai Bất Ngờ Được Yêu Quái Tôn Là Thần Thánh",Thỏ 3 Màu - Review Truyện Tranh,2024-10-08,578497,10939,690
AVKrNX0Dld4,"Thanh Niên Lần Đầu Đóng Giả Quan Công, Giống Đến Nỗi Vô Tình Gọi Luôn Linh Hồn Đến Đòi Công Lý",Góc Nhỏ Review,2026-04-06,26541,438,20
1-qK-Um5cMc,Thử Thách 24H Ở Ngoài Ban Công Cùng Khánh Linh ?,Quang Con Gaming,2025-04-23,1727113,22458,520
1lV_pMEcz-I,[FULL] TÔI HOÁ THÂN THÀNH QUAN CÔNG ĐỂ KIẾM TIỀN | SHARK REVIEW,Cá Hồi Nhỏ,2026-02-26,11574,90,13
dLKbJcMHKno,[Truyện tranh Full] Giả Quan Công Full 7 tiếng #SS1 | ꧁Quan Công Làm Thuê꧂,Feng Shui,2024-10-17,48427,518,45
zhYI0usiAHk,Những Trận Chiến Hay Nhất Của Quan Công Võ Thánh - Quan Vũ Trảm Tướng Dẹp Loạn Thiên Hạ | Yêu Phim,Yêu Phim,2022-07-06,261771,562,36
uME2defl5lQ,"Live 22-4 (Tối): Iran Đáp Trả Mỹ, Tấn Công 3 Tàu, Bắt Giữ 2 Tàu Tại Eo Biển Hormuz",Đàm Quân Sự,2026-04-22,69198,4452,166
kqKuNxTRnxk,"Chọc Vào Cái Nư QUAN VŨ, Đại Tướng HOA HÙNG Rớt Thủ Cấp Trong 1 Nốt Nhạc | Hổ Uy Tướng",MỌT PHIM TRUNG QUỐC,2024-11-09,349700,939,194
0RW3kFrjJBw,QUAN VŨ | Vì sao ông được tôn thờ đến ngày nay | Audio NGHE DỄ NGỦ | Triết Cổ Nhân,Triết Cổ Nhân,2025-04-14,36445,316,61
H1ZP5nEKyBU,Thanh Long Yển Nguyệt Đao Của Quan Vũ Từ Đâu Được Sinh Ra Trên Cõi Đời Này | Quan Công | Chợ Phim,Chợ Phim,2022-07-07,539077,1448,248
tkqC5i5j8P0,Quan Công Vào Rừng Vượt 5 Ải Chém 6 Vị Mãnh Tướng Mạnh Nhất Của Tào Tháo | Kiếm Hiệp Hay,Drama Mỗi Ngày,2022-07-08,378933,887,6
ULbY4ozNsCk,"Quan Công Xuất Thế | Hổ Ác Bất Lực, BOSS Yêu Ma Bại Tận",Shinobi Hành Trình,2025-09-14,24125,304,19
q-W3-TPJHNQ,Giả Làm Quan Công Phần 1 - Phần 7 | CapCapSub,CapCapSub,2026-02-11,123322,1158,68
nacxiwnjzDM,QUAN VŨ liệu có phải vị tướng nổi danh bậc nhất thời Tam quốc?,Spiderum,2025-01-24,277306,1533,361
NWm-u-sgBPE,Bản Lĩnh Của Quan Vũ 20 Tuổi Một Mình Vác Đao Diệt Hổ Tướng Lập Đại Công Giữa Vạn Quân | Yêu Phim,Yêu Phim,2022-07-05,146337,305,20
bKXaGjvugkA,QUAN CÔNG HẠ PHÀM | Phim Lẻ Tam Quốc Diễn Nghĩa Hay Nhất | Thuyết Minh | Trùm Phim,Boss Movies,2022-07-13,642204,0,93
f1lrAUZOTe8,Quan Vũ Khoác Áo Vải Lên Phố Tung Kung Fu Thần Lực Hạ Gục Hết Cao Thủ Giang Hồ | Trùm Phim,Boss Movies,2022-07-05,293918,0,20
eeW-_XW6R7A,TRUYỀN THUYẾT QUAN VÂN TRƯỜNG | Quan Vũ Sinh Ra Như Thế Nào | Phim Tam Quốc Diễn Nghĩa | Chợ Phim,Chợ Phim,2022-07-12,849577,2151,97
TXPiJ5ZNXhk,Quang Con Thử Thách 24H Nắm Tay Khánh Linh Không Buông !!!,Quang Con Gaming,2025-02-23,1185141,8362,358
2291RLwh8ac,Quan Vũ 1 Đao Rung Lở Trời Đất Lấy Mạng Văn Xú Trong 1 Nốt Nhạc | Hổ Uy Tướng,MỌT PHIM TRUNG QUỐC,2024-11-18,46492,159,9
pFpUB44G0d8,1 Ngày Lạnh Lẽo Quang Con Và Khánh Linh Sẽ Làm Những Gì ?,Quang Con Gaming,2025-10-25,392883,3360,141
o5dP4d98h3A,Quan Vũ Vượt 5 Ải Chém 6 Tướng Cả Giới Võ Tướng Nghe Qua Tên Ông Đều Khiếp Sợ | Trùm Phim,Boss Movies,2022-07-06,1346215,0,84
D3N8_6IMw_U,Thờ Quan Công Có Lợi Ích Gì Giải Mã Bí Ẩn Tâm Linh!,HuyK - Kim Hoàn Chế Tác ,2025-07-30,1068,3,2
qqCrqJOkXkc,Nếu đóng giả Quan Công mà giống hoàn toàn với người thật thì sẽ thu hút thứ tà dị bẩn thỉu,Sao Drama,2026-04-02,2202,12,1
lONKV9Nsomw,Xích Thố Về Tay Quan Vũ Và 1 Phen Khiến Tào Tháo Sợ Đến Xanh Mặt | Hổ Uy Tướng,MỌT PHIM TRUNG QUỐC,2024-11-18,74514,199,8
5Jgf9YG0DWg,Chàng Trai 20 Tuổi Nhưng Lại Sở Hữu Sức Mạnh Quan Công | Review Truyện Tranh,Lão Lưu Review,2024-12-31,19354,108,10
Ey8BrwHdCJw,Quan Vũ Tại Hoa Dung: Một Quyết Định Vì Trung Nghĩ,Học viện WECAP,2025-01-09,48847,150,6
i2KTUrkbRRs,Vì sao thờ Quan Công?,Nam Cánh Cam,2023-06-19,38217,262,56
6X_qcFZ4Z-Y,"Khánh Linh Dạy Quang Con Nhảy Tiktok ""Cà Hẩy"" Và Cái Kết Không Nhịn Được Cười ?",Quang Con Gaming,2025-10-30,1534729,10662,443
SVUIg-pCUsg,Vlog | Quang Con Đ.ập N.át Điện Thoại Khánh Linh,Quang Con Gaming,2024-05-11,5232804,38212,31
uHKft4yNhpQ,"NGỌN ĐÈN DẦU #125 | TRÓT LỠ ĐẬP BỂ HÌNH THỜ QUAN CÔNG, CẢ GIA ĐÌNH GẶP ĐIỀM ÁC | XÚC PHẠM THẦN THÁNH",HAUNTED MEKONG,2025-09-19,71017,913,76
BWNZw6Xp2Fo,Quan Công 1 Mình Chặn Đường Thách Đấu Lữ Bố Và 1 Vạn Binh Mã Mạnh Nhất | ONFILM,ON FILM,2022-07-07,155012,324,11
lCZiU_kakNU,Quan Công 1 Mình Vào Rừng Trảm Bay Đầu Sơn Tặc Giải Cứu Vương Phi | Kiếm Hiệp Hay,Drama Mỗi Ngày,2022-07-07,1077995,2355,42
2BAxbjqs35E,Lưu Ý Khi Thờ Quan Công | Thờ Quan Công | Quan Thánh Võ Đế,Độc Lạ Xưa & Nay,2023-08-25,4931,22,2
t7ozWtcVgdU,Sự thật về Quan Vũ có thể bạn chưa biết!! Quan Vũ là ai??,KIẾN THỨC THÚ VỊ Official,2021-12-02,572730,8129,928
hoQLsGQ9ZE4,Đại Tướng Quân Tào Gáy To Ai Ngờ Chưa Kịp Rút Kiếm Đã Bị Triệu Tử Long Cho Liệm | Hổ Uy Tướng,MỌT PHIM TRUNG QUỐC,2024-11-20,400511,810,46
wiRCyPb4TDk,Thử Thách “ Tiêu Hết 100 Triệu Trong 1 Ngày “ Cùng Khánh Linh Và Cái Kết ?,Quang Con Gaming,2026-02-13,1752271,16475,535
9fLE8NVbv_o,Khổng Minh 2 Lần Giết Chu Du Và Vén Màn Bí Ẩn Chu Du Vì Đâu Mà Chết | Quan Công Võ Thánh | Trùm Phim,Boss Movies,2022-07-07,459203,0,84
ilddPpclHxo,Gia Cát Lượng Chỉ 1 Câu Nói Lấy Mạng Quan Vũ Đánh Tào Tháo Chạy Từ Bắc Ra Nam | Trùm Phim,Boss Movies,2022-07-07,605606,0,83
AHvw9B0oSdA,Quan Vũ Quyết Chiến Lưu Bị Sức Mạnh Của Ai Sẽ Ghê Gớm Hơn Ai | Quan Công Võ Thánh | Trùm Phim,Boss Movies,2022-07-06,163224,0,13
Kz66lP59Peg,Quan Công là Ai? (vấn đáp) - Thầy Thích Pháp Hòa,Vấn đáp Thầy Thích Pháp Hòa,2020-05-23,35603,348,46
7PFtI0krDGk,Thờ Quan Công Có Ý Nghĩa Gì Trong Phong Thủy?  | Đồ Cúng Tâm Linh,Đồ Cúng Tâm Linh,2020-05-14,72485,364,32
HX3m3B9f-tU,"Video Cuối Cùng Mình Troll Khánh Linh, Vì Lý Do Này ?",Quang Con Gaming,2025-05-24,1036167,16507,374
gOjoIFI99z4,Chặn Đường Nhầm Quan Công Võ Thánh Cả Băng Cướp Đều Phải Trở Thành Thuộc Hạ | ONFILM,ON FILM,2022-07-06,157807,326,14
7zy50K8aZkk,Quan Vũ Vác Đao Nặng 200Kg Vượt 5 Ải Chém 6 Tướng Làm Nên Trận Đánh Khủng Nhất Tam Quốc | Yêu Phim,Yêu Phim,2022-07-05,344618,783,54
Go3MgwJbi8o,Quan Công Dùng Sức Mạnh Của Rồng Đoạt Mạng Lão Tướng Trước Vạn Quân Tỏ Lòng Trung Thành | Yêu Phim,Yêu Phim,2022-07-06,229755,567,19
wkkiAEjWSIA,Khánh Linh Làm Hoà Với Quang Con Sau 5 Ngày Không Nói Chuyện,Khánh Linh FF,2025-03-16,1055497,9297,497
KJz7112fLVY,Đây Là Cách Gia Cát Khổng Minh Chiếm Thành Không Tốn 1 Binh 1 Tốt | Trùm Phim,Boss Movies,2022-07-11,251417,0,20
VpHtYHBLquQ,Review truyện tranh: Full | Quan Công Nhắm Mắt,Tổ Nghề,2024-09-11,20545,197,0
N61GWzkjyuQ,QUAN VÂN TRƯỜNG VÌ SAO ĐƯỢC THỜ NHƯ VÕ THÁNH?,BLV Hải Thanh History,2022-03-01,54063,676,103
